irun(64): 15.20-s051: (c) Copyright 1995-2018 Cadence Design Systems, Inc.
TOOL:	irun(64)	15.20-s051: Started on Mar 27, 2019 at 09:50:49 IST
irun
	-access +rwc
	decode_stage.v
	tb_decode_s.v
DEFINE gpdk045		$ANALOG/45nm/gpdk045		
|
irun: *W,DLCPTH (/tools/cadence/FOUNDRY/cds.lib,15): cds.lib Permission denied '/tools/cadence/FOUNDRY/analog/45nm/gpdk045' (cds.lib command ignored).
DEFINE rfLib_new	/home/install/FOUNDRY/rfLib_new
|
irun: *W,DLCPTH (/tools/cadence/FOUNDRY/cds.lib,19): cds.lib Invalid path '/home/install/FOUNDRY/rfLib_new' (cds.lib command ignored).
DEFINE gpdk045		$ANALOG/45nm/gpdk045		
|
irun: *W,DLCPTH (/tools/cadence/FOUNDRY/cds.lib,15): cds.lib Permission denied '/tools/cadence/FOUNDRY/analog/45nm/gpdk045' (cds.lib command ignored).
DEFINE rfLib_new	/home/install/FOUNDRY/rfLib_new
|
irun: *W,DLCPTH (/tools/cadence/FOUNDRY/cds.lib,19): cds.lib Invalid path '/home/install/FOUNDRY/rfLib_new' (cds.lib command ignored).
DEFINE gpdk045		$ANALOG/45nm/gpdk045		
|
irun: *W,DLCPTH (/tools/cadence/FOUNDRY/cds.lib,15): cds.lib Permission denied '/tools/cadence/FOUNDRY/analog/45nm/gpdk045' (cds.lib command ignored).
DEFINE rfLib_new	/home/install/FOUNDRY/rfLib_new
|
irun: *W,DLCPTH (/tools/cadence/FOUNDRY/cds.lib,19): cds.lib Invalid path '/home/install/FOUNDRY/rfLib_new' (cds.lib command ignored).
DEFINE gpdk045		$ANALOG/45nm/gpdk045		
|
irun: *W,DLCPTH (/tools/cadence/FOUNDRY/cds.lib,15): cds.lib Permission denied '/tools/cadence/FOUNDRY/analog/45nm/gpdk045' (cds.lib command ignored).
DEFINE rfLib_new	/home/install/FOUNDRY/rfLib_new
|
irun: *W,DLCPTH (/tools/cadence/FOUNDRY/cds.lib,19): cds.lib Invalid path '/home/install/FOUNDRY/rfLib_new' (cds.lib command ignored).
Recompiling... reason: file './tb_decode_s.v' is newer than expected.
	expected: Wed Mar 27 09:49:42 2019
	actual:   Wed Mar 27 09:50:47 2019
DEFINE gpdk045		$ANALOG/45nm/gpdk045		
|
irun: *W,DLCPTH (/tools/cadence/FOUNDRY/cds.lib,15): cds.lib Permission denied '/tools/cadence/FOUNDRY/analog/45nm/gpdk045' (cds.lib command ignored).
DEFINE rfLib_new	/home/install/FOUNDRY/rfLib_new
|
irun: *W,DLCPTH (/tools/cadence/FOUNDRY/cds.lib,19): cds.lib Invalid path '/home/install/FOUNDRY/rfLib_new' (cds.lib command ignored).
DEFINE gpdk045		$ANALOG/45nm/gpdk045		
|
ncvlog: *W,DLCPTH (/tools/cadence/FOUNDRY/cds.lib,15): cds.lib Permission denied '/tools/cadence/FOUNDRY/analog/45nm/gpdk045' (cds.lib command ignored).
DEFINE rfLib_new	/home/install/FOUNDRY/rfLib_new
|
ncvlog: *W,DLCPTH (/tools/cadence/FOUNDRY/cds.lib,19): cds.lib Invalid path '/home/install/FOUNDRY/rfLib_new' (cds.lib command ignored).
file: tb_decode_s.v
	module worklib.tb_decode_stage:v
		errors: 0, warnings: 0
	Total errors/warnings found outside modules and primitives:
		errors: 0, warnings: 2
DEFINE gpdk045		$ANALOG/45nm/gpdk045		
|
irun: *W,DLCPTH (/tools/cadence/FOUNDRY/cds.lib,15): cds.lib Permission denied '/tools/cadence/FOUNDRY/analog/45nm/gpdk045' (cds.lib command ignored).
DEFINE rfLib_new	/home/install/FOUNDRY/rfLib_new
|
irun: *W,DLCPTH (/tools/cadence/FOUNDRY/cds.lib,19): cds.lib Invalid path '/home/install/FOUNDRY/rfLib_new' (cds.lib command ignored).
DEFINE gpdk045		$ANALOG/45nm/gpdk045		
|
irun: *W,DLCPTH (/tools/cadence/FOUNDRY/cds.lib,15): cds.lib Permission denied '/tools/cadence/FOUNDRY/analog/45nm/gpdk045' (cds.lib command ignored).
DEFINE rfLib_new	/home/install/FOUNDRY/rfLib_new
|
irun: *W,DLCPTH (/tools/cadence/FOUNDRY/cds.lib,19): cds.lib Invalid path '/home/install/FOUNDRY/rfLib_new' (cds.lib command ignored).
DEFINE gpdk045		$ANALOG/45nm/gpdk045		
|
ncelab: *W,DLCPTH (/tools/cadence/FOUNDRY/cds.lib,15): cds.lib Permission denied '/tools/cadence/FOUNDRY/analog/45nm/gpdk045' (cds.lib command ignored).
DEFINE rfLib_new	/home/install/FOUNDRY/rfLib_new
|
ncelab: *W,DLCPTH (/tools/cadence/FOUNDRY/cds.lib,19): cds.lib Invalid path '/home/install/FOUNDRY/rfLib_new' (cds.lib command ignored).
		Caching library 'worklib' ....... Done
	Elaborating the design hierarchy:
		Caching library 'worklib' ....... Done
	Top level design units:
		tb_decode_stage
	Building instance overlay tables: .................... Done
	Generating native compiled code:
DEFINE gpdk045		$ANALOG/45nm/gpdk045		
|
ncvlog_cg: *W,DLCPTH (/tools/cadence/FOUNDRY/cds.lib,15): cds.lib Permission denied '/tools/cadence/FOUNDRY/analog/45nm/gpdk045' (cds.lib command ignored).
DEFINE rfLib_new	/home/install/FOUNDRY/rfLib_new
|
ncvlog_cg: *W,DLCPTH (/tools/cadence/FOUNDRY/cds.lib,19): cds.lib Invalid path '/home/install/FOUNDRY/rfLib_new' (cds.lib command ignored).
		worklib.tb_decode_stage:v <0x637254e6>
			streams:  15, words: 23652
	Building instance specific data structures.
	Loading native compiled code:     .................... Done
	Design hierarchy summary:
		              Instances  Unique
		Modules:              4       4
		Registers:           32      32
		Scalar wires:        17       -
		Vectored wires:      17       -
		Always blocks:        5       5
		Initial blocks:       5       5
		Cont. assignments:    8      24
		Pseudo assignments:   7       7
	Writing initial simulation snapshot: worklib.tb_decode_stage:v
DEFINE gpdk045		$ANALOG/45nm/gpdk045		
|
ncsim: *W,DLCPTH (/tools/cadence/FOUNDRY/cds.lib,15): cds.lib Permission denied '/tools/cadence/FOUNDRY/analog/45nm/gpdk045' (cds.lib command ignored).
DEFINE rfLib_new	/home/install/FOUNDRY/rfLib_new
|
ncsim: *W,DLCPTH (/tools/cadence/FOUNDRY/cds.lib,19): cds.lib Invalid path '/home/install/FOUNDRY/rfLib_new' (cds.lib command ignored).
Loading snapshot worklib.tb_decode_stage:v .................... Done
ncsim> source /tools/cadence/INCISIVE152/tools/inca/files/ncsimrc
ncsim> run
[PASS] ype immediate sign-extend (ADDI)
[PASS]      S-type immediate build (SB)
[PASS]    mem_write asserted for S-type
[PASS]      S-type immediate build (SH)
[PASS]       id_flush forces NOP decode
[PASS]           wb_load true for ILOAD
[PASS]   mem_load_type LB for func3=000
[PASS]  mem_load_type LBU for func3=100
[PASS] ead after write (x5 == DEADBEEF)
[PASS] ing: read forwarded value for x9
[PASS]  asserted for unsupported opcode
=======================================
DECODE_STAGE TB SUMMARY
 PASSED = 11
 FAILED = 0
 OVERALL RESULT: PASS
=======================================
Simulation complete via $finish(1) at time 140 NS + 0
./tb_decode_s.v:230         $finish;
ncsim> exit
TOOL:	irun(64)	15.20-s051: Exiting on Mar 27, 2019 at 09:50:49 IST  (total: 00:00:00)
