irun(64): 15.20-s051: (c) Copyright 1995-2018 Cadence Design Systems, Inc.
TOOL:	irun(64)	15.20-s051: Started on Mar 29, 2019 at 03:34:40 IST
irun
	-access +rwc
	data_mem.v
	tb_data.v
DEFINE gpdk045		$ANALOG/45nm/gpdk045		
|
irun: *W,DLCPTH (/tools/cadence/FOUNDRY/cds.lib,15): cds.lib Permission denied '/tools/cadence/FOUNDRY/analog/45nm/gpdk045' (cds.lib command ignored).
DEFINE rfLib_new	/home/install/FOUNDRY/rfLib_new
|
irun: *W,DLCPTH (/tools/cadence/FOUNDRY/cds.lib,19): cds.lib Invalid path '/home/install/FOUNDRY/rfLib_new' (cds.lib command ignored).
DEFINE gpdk045		$ANALOG/45nm/gpdk045		
|
irun: *W,DLCPTH (/tools/cadence/FOUNDRY/cds.lib,15): cds.lib Permission denied '/tools/cadence/FOUNDRY/analog/45nm/gpdk045' (cds.lib command ignored).
DEFINE rfLib_new	/home/install/FOUNDRY/rfLib_new
|
irun: *W,DLCPTH (/tools/cadence/FOUNDRY/cds.lib,19): cds.lib Invalid path '/home/install/FOUNDRY/rfLib_new' (cds.lib command ignored).
DEFINE gpdk045		$ANALOG/45nm/gpdk045		
|
irun: *W,DLCPTH (/tools/cadence/FOUNDRY/cds.lib,15): cds.lib Permission denied '/tools/cadence/FOUNDRY/analog/45nm/gpdk045' (cds.lib command ignored).
DEFINE rfLib_new	/home/install/FOUNDRY/rfLib_new
|
irun: *W,DLCPTH (/tools/cadence/FOUNDRY/cds.lib,19): cds.lib Invalid path '/home/install/FOUNDRY/rfLib_new' (cds.lib command ignored).
DEFINE gpdk045		$ANALOG/45nm/gpdk045		
|
irun: *W,DLCPTH (/tools/cadence/FOUNDRY/cds.lib,15): cds.lib Permission denied '/tools/cadence/FOUNDRY/analog/45nm/gpdk045' (cds.lib command ignored).
DEFINE rfLib_new	/home/install/FOUNDRY/rfLib_new
|
irun: *W,DLCPTH (/tools/cadence/FOUNDRY/cds.lib,19): cds.lib Invalid path '/home/install/FOUNDRY/rfLib_new' (cds.lib command ignored).
Recompiling... reason: file './data_mem.v' is newer than expected.
	expected: Tue Mar 26 01:38:04 2019
	actual:   Fri Mar 29 03:34:34 2019
DEFINE gpdk045		$ANALOG/45nm/gpdk045		
|
irun: *W,DLCPTH (/tools/cadence/FOUNDRY/cds.lib,15): cds.lib Permission denied '/tools/cadence/FOUNDRY/analog/45nm/gpdk045' (cds.lib command ignored).
DEFINE rfLib_new	/home/install/FOUNDRY/rfLib_new
|
irun: *W,DLCPTH (/tools/cadence/FOUNDRY/cds.lib,19): cds.lib Invalid path '/home/install/FOUNDRY/rfLib_new' (cds.lib command ignored).
DEFINE gpdk045		$ANALOG/45nm/gpdk045		
|
ncvlog: *W,DLCPTH (/tools/cadence/FOUNDRY/cds.lib,15): cds.lib Permission denied '/tools/cadence/FOUNDRY/analog/45nm/gpdk045' (cds.lib command ignored).
DEFINE rfLib_new	/home/install/FOUNDRY/rfLib_new
|
ncvlog: *W,DLCPTH (/tools/cadence/FOUNDRY/cds.lib,19): cds.lib Invalid path '/home/install/FOUNDRY/rfLib_new' (cds.lib command ignored).
	Total errors/warnings found outside modules and primitives:
		errors: 0, warnings: 2
DEFINE gpdk045		$ANALOG/45nm/gpdk045		
|
irun: *W,DLCPTH (/tools/cadence/FOUNDRY/cds.lib,15): cds.lib Permission denied '/tools/cadence/FOUNDRY/analog/45nm/gpdk045' (cds.lib command ignored).
DEFINE rfLib_new	/home/install/FOUNDRY/rfLib_new
|
irun: *W,DLCPTH (/tools/cadence/FOUNDRY/cds.lib,19): cds.lib Invalid path '/home/install/FOUNDRY/rfLib_new' (cds.lib command ignored).
DEFINE gpdk045		$ANALOG/45nm/gpdk045		
|
irun: *W,DLCPTH (/tools/cadence/FOUNDRY/cds.lib,15): cds.lib Permission denied '/tools/cadence/FOUNDRY/analog/45nm/gpdk045' (cds.lib command ignored).
DEFINE rfLib_new	/home/install/FOUNDRY/rfLib_new
|
irun: *W,DLCPTH (/tools/cadence/FOUNDRY/cds.lib,19): cds.lib Invalid path '/home/install/FOUNDRY/rfLib_new' (cds.lib command ignored).
DEFINE gpdk045		$ANALOG/45nm/gpdk045		
|
ncelab: *W,DLCPTH (/tools/cadence/FOUNDRY/cds.lib,15): cds.lib Permission denied '/tools/cadence/FOUNDRY/analog/45nm/gpdk045' (cds.lib command ignored).
DEFINE rfLib_new	/home/install/FOUNDRY/rfLib_new
|
ncelab: *W,DLCPTH (/tools/cadence/FOUNDRY/cds.lib,19): cds.lib Invalid path '/home/install/FOUNDRY/rfLib_new' (cds.lib command ignored).
		Caching library 'worklib' ....... Done
	Elaborating the design hierarchy:
	Top level design units:
		tb_data_mem
	Building instance overlay tables: .................... Done
	Building instance specific data structures.
	Loading native compiled code:     .................... Done
	Design hierarchy summary:
		              Instances  Unique
		Modules:              2       2
		Registers:           22      22
		Scalar wires:         3       -
		Vectored wires:       7       -
		Always blocks:        5       5
		Initial blocks:       3       3
		Cont. assignments:    1       2
		Pseudo assignments:   7       7
	Writing initial simulation snapshot: worklib.tb_data_mem:v
DEFINE gpdk045		$ANALOG/45nm/gpdk045		
|
ncsim: *W,DLCPTH (/tools/cadence/FOUNDRY/cds.lib,15): cds.lib Permission denied '/tools/cadence/FOUNDRY/analog/45nm/gpdk045' (cds.lib command ignored).
DEFINE rfLib_new	/home/install/FOUNDRY/rfLib_new
|
ncsim: *W,DLCPTH (/tools/cadence/FOUNDRY/cds.lib,19): cds.lib Invalid path '/home/install/FOUNDRY/rfLib_new' (cds.lib command ignored).
Loading snapshot worklib.tb_data_mem:v .................... Done
ncsim> source /tools/cadence/INCISIVE152/tools/inca/files/ncsimrc
ncsim> run
PASS:    LW read addr=0x0 got=0x11223344
PASS:  LB signed addr=0x1 got=0xffffffaa
PASS: U unsigned addr=0x1 got=0x000000aa
PASS:   LH lower addr=0x3 got=0x00001234
PASS:  LHU lower addr=0x3 got=0x00001234
PASS: per signed addr=0x6 got=0xffffabcd
PASS: upper zero addr=0x6 got=0x0000abcd
FAIL: yte update addr=0x10 got=0xaabb77dd expected=0xaa77ccdd
ALL tests in tb_data_mem_fixed completed.
Simulation complete via $finish(1) at time 306 NS + 0
./tb_data.v:135         $finish;
ncsim> exit
TOOL:	irun(64)	15.20-s051: Exiting on Mar 29, 2019 at 03:34:40 IST  (total: 00:00:00)
